sample_id,sent_id,sentence,prob_1
432,2574633,He eventually joined the Ulster Group Theatre where he learned the behind the scenes tasks of the theatre.,-40.50248718261719
433,1803061,Norwood is in the north of the town and surrounds the main road which leads to Waleswood.,-42.11113357543945
434,160500,"The band split in mid-2008, following Quinn's announcement of his retirement from music.",-15.383842468261719
435,2582091,"Casson was mayor of Picture Butte, Alberta from 1986 to 1995 and a councillor before that.",-32.498416900634766
436,46274,During the World War II a depository as well as an exposition was located in the synagogue.,-17.583192825317383
437,644725,"In 1857, a major expansion of the school was planned, but the Panic of 1857 intervened.",-8.489234924316406
438,1330039,News updates occur more often on radio than on television – usually about once or twice an hour.,-33.30358123779297
439,784562,"There were no soloists, but it is claimed that a dancer nicknamed Little Egypt stole the show.",-50.25835418701172
440,269145,"The shelter had belonged to a Mr. R. A. Pancake of Hamilton, Illinois.",-36.466766357421875
441,3115148,"According to the 2004 census (INE), the municipality had a population of 43 inhabitants.",-11.998367309570312
442,2887756,"These shows are often drag queen/king performances, and some of them may have adult content.",-38.412109375
443,2348786,"In 1935, Böke started in a 3–1 final win against Altınordu.",-69.65753173828125
444,111054,"A scholar of ""kalam"" is referred to as a ""mutakallim"".",-28.72887420654297
445,951652,The Malagasy Sign Language is a sign language used for communication among hearing impaired people in Madagascar.,-6.052784442901611
446,2691875,The strained financial situation of the club meant that bankruptcy proceedings had to be opened in July 2010.,-27.24639892578125
447,3257822,"In 1884, the first newspaper in the city ""Niški Vesnik"" was started.",-36.323204040527344
448,735212,However Stoke quickly ended the match as a contest after the half time break with two quick goals.,-37.50474548339844
449,1905332,He competed for Go & Fun Honda Gresini in the 2013 MotoGP World Championship.,-45.621124267578125
450,3291790,She married Sudarshan Ghosh Dastidar on 30 November 1982 and has two sons.,-19.652053833007812
452,335830,"However, fashion critics were initially divided in opinion regarding Paltrow's choice of dress.",-16.482746124267578
453,3473608,These four markets are linked by cash flow and push the market traders in the direction they want.,-27.819561004638672
454,1272744,"Analog TV can experience ""ghosts"" from delayed signals bouncing back and forth on a long line.",-54.264549255371094
455,1083490,"it is the official ""birth, graduation, wedding, and death certificate"" of a unit.",-35.74495315551758
456,1667119,"""Rock Hard"" journalist Björn Thorsten Jaschinski called them ""occult metal pioneers"".",-46.25817108154297
457,79221,She attended teacher's college and began teaching art at Memorial School in Niagara Falls in 1924.,-38.27135467529297
458,956641,We have got to get people to appreciate there are a lot of positive things about ill health.,-33.25096130371094
459,279199,Hardwired is a 1986 cyberpunk science fiction novel by American writer Walter Jon Williams.,-31.53935432434082
460,2039246,"The district includes East Hampton, Shelter Island, Southampton and portions of Brookhaven in Suffolk County.",-21.130577087402344
461,1337525,"Batman: The Ride clones operate with two steel and fiberglass trains, each containing eight cars.",-50.64628601074219
462,2983273,"By luck, this species did not make its own vitamin C, whereas mice and rats do.",-34.894187927246094
463,1905750,It's no longer common practice to allow dropped food to stay on the floor for weeks.,-30.334007263183594
464,974189,"As of 19 August 2014, its stated capital was GH¢217,467.",-48.59776306152344
465,2604192,"The party has since retained their single seat in elections in 1995, 2000, 2004 and 2010.",-26.782642364501953
466,2756087,"In this incarnation, the band released ""I Suck on that Emotion"", through Drag City.",-37.75795364379883
467,2672262,Archer Thompson Gurney (1820–1887) was a Church of England clergyman and hymnodist.,-65.13275146484375
468,964550,There is a church (now in ruins) and graveyard for the Parish of Creich.,-23.463346481323242
469,177502,"Jackson maintains his lifelong commitment to high quality USA made guitars, most featuring superstrat design.",-56.623130798339844
470,445145,"Heerenveen had to play against the other losing semi-finalist, Twente.",-8.9082612991333
471,2179502,The design of the head varied greatly with a variety of interchangeable parts and rivets.,-19.901283264160156
472,2767105,"Signs are used to symbolize things, but are considered things themselves because they too represent meaning.",-41.627140045166016
473,110756,"On 1 June, Matías Fernández pulled out due to injury and was replaced by Mark González.",-22.815048217773438
474,2134297,He entered the Illinois state checkers championship in 1933 at age 18 and finished in third place.,-18.61923599243164
475,1809469,"Over time, the driver's behavior is conformed with the requirements by repetition and habit.",-58.62541961669922
476,1924224,Dixie Selden was left an only child when two of her siblings died when they were infants.,-24.234439849853516
477,954421,Directorate of Education divides Delhi region into 12 districts and 28 zones with hierarchy from district to zones.,-53.60038375854492
478,3469363,"He ran unsuccessfully for a seat in the Quebec assembly in 1973, losing to Marcel Bédard.",-14.433340072631836
479,2157493,"During the courtyard party scenes, a brief clip shows Poehler, Jones and Schneider dancing together.",-39.927032470703125
480,3383729,The stadium appearance is shaped by a colonnade consisting of several columns arranged in a circle.,-35.492431640625
481,1637475,"Males had a median income of $26,250 versus $14,792 for females.",-14.754044532775879
482,93102,Near this idol is an ancient temple - safe as only Shinobu knows of its existence.,-42.30011749267578
483,2028237,Warlords of Utopia is an original novel by Lance Parkin set in the Faction Paradox universe.,-34.04589080810547
484,2535819,The player earns up to 10 points for their placing in all the races within the event.,-28.01430892944336
486,2194814,"Peter soon remarried, but Dorothy did not get along with his new wife, Elizabeth Abbott Thompson.",-40.67691421508789
487,792003,"The finals were held at the Beilun Sports and Arts Centre in Ningbo, China.",-21.367834091186523
488,1140474,North of the house is a 17th-century sundial mounted on a 13th-century column.,-15.912443161010742
489,1608464,Immokalee's public schools are operated by the District School Board of Collier County.,-15.015694618225098
490,2828893,"Any question is full of meaning to which, as here, contrary answers lead to contrary behavior.",-62.14453125
491,3097641,Centropogon saltuum is a species of plant in the family Campanulaceae.,-13.754281997680664
492,2172536,The original clan badges were merely plants worn in bonnets or hung from a pole or spear.,-59.96113586425781
493,1019265,"It derives its name from the Italian word for eggplant, ""melanzane"".",-25.153078079223633
494,243355,"Harris's website contained directions on making pipe bombs, including use of shrapnel.",-47.879310607910156
495,1279188,"The main ingredients are beef, chicken, tomatoes, cabbage, lima beans, and green beans.",-27.19466781616211
496,233743,"Partnerships may arise from business connections, travel, similar industries, diaspora communities, or shared history.",-55.8366813659668
497,1371941,"On December 10, 1958 Sosnovy Bor was granted the urban-settlement status.",-19.137353897094727
498,2015211,Having a cleft palate/lip does not inevitably lead to a psychosocial problem.,-20.01488494873047
499,3531628,The Baoulé have a calendar that is different from the calendar of other Akan ethnic groups.,-13.2269287109375
500,3037760,The vote-out was held and Snehashish was voted out of the show.,-25.17269515991211
501,1053450,This company purchased all the water-bearing lands in the valley and began drilling artesian wells.,-20.609935760498047
502,546658,"On immigration, Card's research has shown that the economic impact of new immigrants is minimal.",-21.58069610595703
503,518557,In 1971 he was invited to rejoin the IWA and became a vice-president in 1983.,-28.13772201538086
504,1005374,The Government of India recognised his services by issuing a commemorative postage stamp in his honour in 2008.,-16.753952026367188
505,431378,A. Harmsworth Glacier or Alfred Harmsworth Glacier is a glacier in northern Greenland.,-10.930320739746094
506,585038,"He pursued truth, the meaning of life and humanity in Buddhism, Hinduism and other major religions.",-32.04044723510742
507,2924230,"The coaches were adorned with posters of Wong, and potentially constitutes an illegal election-related expense.",-66.4863052368164
508,1744088,"However, as far as most layperson customers know, they are simply dealing with GEICO.",-46.37073516845703
509,167071,"Heidemann spent most of on the bench, collecting 145 at-bats in 65 games.",-37.45429229736328
510,3243394,"""Tic-Tac-Dough"" did not go unscathed before its cancellation.",-21.122732162475586
511,1319905,Benito Mussolini's unsuccessful invasion of Greece prompted Germany to invade Yugoslavia and Greece in April 1941.,-29.10622215270996
512,701646,Arbind Rimal hails from a middle-class Brahmin family in Kathmandu.,-42.54440689086914
513,1571475,"Alydar also won the Flamingo Stakes, Blue Grass Stakes, and the Arlington Classic.",-11.74620246887207
514,422883,"It was Japan's first ever quarter-final win, and ensured its highest ever ranking.",-24.26896095275879
515,1280084,This grandfather was son of Publius Licinius Crassus (consul 171 BC).,-29.533334732055664
516,2232120,"The new bishop of Speyer, Mathew of Rammung, took over in 1464.",-46.363914489746094
517,3504776,"Sophomore cornerback Tracy Howard also earned such recognition, recording 32 tackles and 4 interceptions on the season.",-39.64131164550781
518,2209129,In June 2016 she was tested positive on Mephentermine and later suspended for eight years.,-43.35188293457031
519,3466714,"Upon retiring from this position after 28 seasons, he was given the honor of Music Director Emeritus.",-29.196027755737305
520,2797848,"The murders shocked the nation, and Sherman wired to have the Modocs exterminated.",-39.51136016845703
521,1202507,Iridopsis fragilaria is a species of geometrid moth in the family Geometridae.,-7.917465686798096
522,1598611,"In spite of the claimed interest, the stadium never attracted a serious offer from a professional team.",-39.2526741027832
523,1651332,"In 2017, another vote was held, updating the house names with a new tutor system.",-52.45482635498047
524,70809,"From the corps, the Swedish Army was provided with staff for various commissary positions.",-36.882328033447266
525,3407001,"Apparently, the crew of ""YF-415"" was not briefed on this procedure.",-29.293930053710938
526,1041301,In 2013 der Freitag received a silver medal in the category lead paper of the year.,-33.33245849609375
527,1727851,"Rep. Lucio represents District 38, which is composed of the southwest region of Cameron County.",-33.90211486816406
528,635289,"However, Ambrose immediately attacked Rollins after the match, turning heel for the first time since 2014.",-30.24753761291504
529,3198319,On 2008-03-08 FCK faced the 1st Division team Næstved BK.,-32.23795700073242
530,3402698,"In Zbehy and Leopoldov, partisans returning by train attacked Jewish residences near the station.",-62.42313766479492
531,2377895,"Opahle is also active as a studio musician and producer, among others for Alexandra Stan.",-47.94612503051758
532,1013895,"At the start of the 1990s an edition called Manager was produced, featuring different factories of Leningrad.",-65.00282287597656
533,3365629,Odontobunus is a genus of harvestmen in the family Phalangiidae.,-8.50041675567627
534,252927,"Nottinghamshire is sheltered by the Pennines to the west, so receives relatively low rainfall at annually.",-46.23100280761719
535,2355118,It has dots or stars in the fabric that are smaller than that of Type 07 digital camouflage.,-57.3525505065918
536,3013038,"The Divine Mercy Shrine is a Catholic monument in El Salvador, Misamis Oriental, Philippines.",-24.064537048339844
537,608361,In November 2016 she was appointed senior vice-president and general counsel for the World Bank Group.,-14.227384567260742
538,2456276,"Omair tries to force himself on Diana, but is almost stabbed by one of his women.",-46.159786224365234
539,1058732,They had arrived at the wall half an hour early and so faced fire from their own guns.,-27.584909439086914
540,231434,They did not require torcs or other mechanical assistance to be able to use their psychic powers.,-35.71092987060547
541,3459369,The remainder of the line to Oberschlema closed in 1990 and was subsequently demolished.,-25.17819595336914
542,589530,West Flanders is a parliamentary constituency in Belgium used to elect members of the Flemish Parliament since 2004.,-5.092369079589844
543,2594123,"If a group of responses have the same function, this group may be called a response class.",-26.05188751220703
544,2642967,On that date Monson Slate Company received permission to use a highway truck for common carrier service.,-51.79721450805664
545,1985769,"First in Minnesota at Mahnomen and Two Harbors, Minnesota for five years total.",-46.83169174194336
547,1731306,"Infant mortality rate for Malaysia in 2016 was 7.1 deaths per 1,000 live births.",-20.523412704467773
548,2600308,It elected one Member of Parliament (MP) by the first past the post system of election.,-3.1885995864868164
549,1095046,As a senior in 1987 Dawson was named second-team All-Southeastern Conference (SEC).,-17.355377197265625
550,1528129,"While in high school, his father died, and he came under his grandfather's care.",-12.33790111541748
551,1783145,"The population of the region of Chameria was mainly Albanian and Greek, with smaller minorities.",-18.962926864624023
552,1387132,Norway at the time was experiencing a population decline that it was attempting to slow or even reverse.,-22.17110252380371
553,17055,"On the 26 January 1900, she married Edward Lane, who worked at a Bristol wagon works.",-43.325294494628906
554,1635875,The gender makeup of the village was 39.8% male and 60.2% female.,-6.120256423950195
555,3356285,"He moved to Swindon Town in 2001, and went on to make more than 200 league appearances.",-9.185617446899414
556,849913,"The White Oak Creek Covered Bridge, near Alvaton, Georgia, was built in 1880.",-47.53016662597656
557,3467204,"""Brake"" is an old word for fern, related to the word ""bracken"".",-26.315507888793945
558,2625550,He went on the 15-day disabled list after suffering a right oblique strain on April 14.,-23.145626068115234
559,1819446,It features actors Samadarshi Dutta and Debosmita in the lead roles.,-31.668031692504883
560,546298,"Larson and her sister traveled throughout Europe in a bus, before she settled in Paris, France.",-31.92531967163086
561,708637,"After a two-year investigation, Majors was arrested in December 1997 and charged with seven murders.",-24.597673416137695
562,2156069,"Both iPhone ""Galcons"" received excellent reviews, but there was a smaller publicity angle.",-69.36729431152344
563,2875596,"Series four was released on 1 March 2012, and also contained episode four from the third series.",-25.38108253479004
564,1097074,"After Enigma went out of business in 1991, the label moved to Rhino Records for several years.",-22.737409591674805
565,3051810,"The [Chinese] performer portrays incidents of utmost passion, but without his delivery becoming heated.",-80.12530517578125
566,2993900,"This clinic helps a lot of people living that area, as it is the only clinic available.",-28.209884643554688
567,1128824,"As part of the expansion, Borgata installed a poker room, the largest in Atlantic City.",-32.53984832763672
568,149916,"The four teams from the previous two rounds, plus Spain and Samoa, competed in a tournament.",-42.45269012451172
569,126551,"The hyphen is used for word breaks, and there are both parentheses and double parentheses.",-35.16362762451172
570,1589665,"In the name of defending democracy, the manuals advocate profoundly undemocratic methods.",-53.56231689453125
571,3240213,Lorelei battles several Asgardians and subsequently becomes trapped in the dimension of the Great Beasts.,-29.92121124267578
572,2340478,Spiezio batted 18 for 55 (.327) for Anaheim in the playoffs that year.,-47.446380615234375
573,1260985,"In humans, the MYH16 gene has a mutation that causes the protein not to function.",-27.090389251708984
574,3174782,The power plant will have a total capacity of 200 MW with potential for expansion up 600 MW.,-27.728416442871094
575,318855,The episode was officially released on Machinima.com's YouTube channel on July 24.,-18.235538482666016
576,3323703,"The duo met at school and via their mutual interest in music production, they formed Third Party.",-33.65509033203125
577,92636,In 1999 John Gephart IV took over and continued to update the site until early 2001.,-43.906494140625
578,1604602,"Males had a median income of $24,196 versus $55,556 for females.",-35.81238555908203
579,3266912,"As a consequence, production fell, food became short and protests occurred in a number of factories.",-44.19790267944336
580,1729634,Cobalt is an essential element for health in animals in minute amounts as a component of Vitamin B.,-34.19844055175781
581,3452918,"To the south of the bog is found ancient woodland containing Scots Pine, birch and willow trees.",-35.30512237548828
582,63986,"Wheeler is an unincorporated community in Washington County, in the U.S. state of Arkansas.",-17.784069061279297
583,2198284,"Named an assistant professor at the university in 1893, Clark rose to full professor status in 1900.",-32.36803436279297
584,2948652,"Males had a median income of $27,720 versus $19,575 for females.",-17.227617263793945
585,1005502,He flirts with a guest in front of her and she accuses him of being shallow.,-17.067731857299805
586,1936190,The Late Empire furniture is supplemented with a bronze clock from France and canvasses with mythological themes.,-51.147308349609375
587,3142229,"In the middle Madonna is the central and biggest figure in the painting, holding a small child.",-28.299997329711914
588,2001773,The Hats eagerly caught at the opportunity of recovering the lost lands and their own prestige with it.,-70.96920776367188
590,3022328,The existing versions of this film appear to be from the re-edited 1918 re-release.,-29.463205337524414
591,2539688,"In 2001, he was conferred a Jean Monnet Chair by the Commission of the European Union.",-28.26822280883789
592,2072337,Trophy as the ground was lacking in basic facilities and was considered to be in a dangerous condition.,-46.410621643066406
593,3125709,The C&K Beaconsfield Community Kindergarten is on-site at the Beaconsfield State School.,-27.230676651000977
594,2242277,"After the war, the duo captured several prizes at the 1867 and 1868 St. Louis Fairs.",-25.101184844970703
595,946185,"It did not chart in any other countries, except for Scotland where it peaked at #92.",-13.225393295288086
596,471923,"She was born in London, Ontario, and was the daughter of James and Nora McHale.",-20.008949279785156
597,2339384,"By maintaining the same tone throughout the novel, García Márquez makes the extraordinary blend with the ordinary.",-36.096534729003906
598,3319741,"Culture Club had the best-selling single of the year with ""Karma Chameleon"".",-18.968910217285156
599,3478779,"Peter tries to explain, but Emma, shocked by what he did, asks him to leave.",-24.05887222290039
600,1382777,Overnight he goes from being the richest man in town to a mere shadow of his former self.,-20.634971618652344
601,2861954,"This hospital is located in the west of the suburb, close to its boundary with Halfway Bush.",-41.51347732543945
602,830554,"After receiving her primary and secondary education, Schmidt enrolled in college where she majored in journalism.",-16.613494873046875
603,3404060,"The distance to Vologda is 73 km, to Novlenskoye is 11 km.",-43.08607482910156
604,3078300,"In 1923, he became the headmaster of the Preparatory Geelong Grammar School where he stayed until 1927.",-38.200904846191406
605,3150325,He has practised law since 2006 and is a former chairman of the Berryville Chamber of Commerce.,-23.802698135375977
607,2577783,"In the grounds of the building is the last remaining well on site, known as Gil Well.",-38.82850646972656
608,3382801,The ground colour of the hindwing upperside is yellowish-orange with a brown marginal band.,-13.299007415771484
609,2967200,"While the Spartans refrained from action themselves, some of their allies began to talk of revolt.",-35.04230880737305
610,274868,Buffer zones need to be put in to protect the stream habitats from runoff and siltation.,-26.790876388549805
611,2822526,The group enjoyed experimenting with different sounds to see which would be worth incorporating into the final product.,-26.749601364135742
613,887,"Daviess County Courthouse is a historic courthouse located at Gallatin, Daviess County, Missouri.",-1.6338253021240234
614,2049703,The proposed design changed the twin-engined Warwick wing for an elliptical wing with four Merlin engines.,-48.44810485839844
615,2989033,The span wing can be folded for ground transportation or storage and the wing tips are removable.,-22.758148193359375
616,1830164,Methods have been proposed to use the operational semantics of machine languages to automatically generate verification condition generators.,-45.036834716796875
617,3532025,Sir Bernard Ingham (born 21 June 1932) is a British journalist and former civil servant.,-29.64423942565918
618,580081,State Road 205 (NM 205) is a state highway in the US state of New Mexico.,-1.744072437286377
619,422969,One day a village child was attacked by a wild animal and the dog rushed to his aid.,-30.33868408203125
620,3285452,These subsystems may also have access control lists associated with them to control who may call them.,-45.55253219604492
621,243151,"However, in general, some primary solid also remains and a complex solubility equilibrium establishes.",-59.200504302978516
622,2166262,"The growth rate is rapid in the first year, then slows down as the fish age.",-15.29083251953125
623,25427,"""jj n° 2"" received a ""Best New Music"" designation from ""Pitchfork"".",-33.06610107421875
624,2149091,"However, research has shown that only 7% of all communications is directly related to verbal communications.",-34.43363571166992
625,2342296,Transactions can be made using a variety of contactless payment solutions including Google Pay and Apple Pay.,-16.41620635986328
626,856131,"Instead, the newspaper focused on opening its columns to various Polish organizations, unions, and societies.",-39.813507080078125
627,2553182,"Based on their research, ORN members publish papers in both academic and practitioner-oriented journals.",-21.75225067138672
628,2227050,"In July 2013, Death Grips launched ""Third Worlds"", an imprint label of Harvest Records.",-34.73138427734375
629,1820709,"Dexter Vex is arrested in America, alongside another Irishman, Caius Calavier.",-67.87704467773438
630,2621973,"In a great number of songs, guest musicians took part, adding mainly to the brass section.",-35.037445068359375
631,3213637,The 1985–86 Women's IHF Cup was the fifth edition of the competition.,-46.66300582885742
632,33078,"After his clerkship, Newton worked as a public defender in both the state and federal systems.",-19.927703857421875
633,1997296,Actors Bob Hoskins and John Leguizamo were ultimately cast as Mario and Luigi.,-8.836273193359375
634,1465393,"After wide local opposition, the freeway was removed from the Interstate System on August 22, 1969.",-34.819923400878906
635,2954492,The gender makeup of the town was 47.4% male and 52.6% female.,-1.7955799102783203
636,1694517,"The question of independence must be bound up with that of the proletarian socialist revolution.",-24.24187469482422
637,1907578,"The piece is mostly energetic and triumphant, but it includes a slower section containing a funeral march.",-44.96643829345703
638,307260,Stephanie Gray Chang is a Democratic politician from Michigan currently representing the 1st district of the Michigan Senate.,-36.36052322387695
639,1434066,He was also Inspector of Music to the Board of Education from 1928 until his retirement in 1942.,-32.37242126464844
640,1895720,Season three features the Jennings coping with the stress of preparing to reveal their true nature to Paige.,-54.47318649291992
641,2967348,"He was an international celebrity, with often as much interest in his personal life as his art.",-22.833017349243164
642,2312445,"She and other member Cochrane don't get on, which is obvious from the message forums.",-57.368804931640625
643,125300,They belonged to the Chahamana (Chauhan) clan of the Rajputs.,-11.808305740356445
644,231430,"They also have a much more muscular figure, and often have stronger metapsychic powers.",-22.691184997558594
646,1353609,"Since the late 1970s, batteries have been added to Skeletons to give them extra durability.",-23.15913200378418
647,3333910,"The Finale can be found on the More Amadeus soundtrack, conducted by Sir Neville Marriner.",-39.747161865234375
648,2384130,"Having fallen to 157th in the world rankings, Greaves was relegated from the tour in 1993.",-41.04783630371094
