sample_id,sent_id,sentence,prob_1
216,95134,These loans bound the labourer to the estate who was not charged with interest on the loan.,-43.46102523803711
217,2703561,"Under most circumstances, relative nonlinearity will help one species to invade, and hurt the other.",-55.40300750732422
218,2353044,However the MRF was able to return to their base by 02:20 on 1 February.,-30.095117568969727
219,3328899,"On the other hand, Alexander Sceresse attacked the University, calling for law and order.",-47.77299499511719
220,3136882,The passive and gentle expression on her face is also denoted with an air of approachability according.,-59.50261688232422
221,3428865,The small white flowers grow in a fairly showy panicles from the top of the stem.,-27.403173446655273
222,3318257,Rabold and Morales rehearsed at Center Staging in Burbank with the band alone.,-52.75566864013672
223,1305577,"In the meantime, the Soviet Union was dissolved, and with its dissolution the Cold War ended.",-9.810894966125488
224,2531027,"At Lord Cherwell's recommendation, Butt did an analysis of the effectiveness of Bomber Command.",-37.274593353271484
225,83653,"A seventh 25 MW unit was brought into use in September 1937, expanding capacity to 175 MW.",-42.700439453125
226,2222623,He then transferred to Princeton University and played for the Princeton Tigers football team from 1913 to 1915.,-15.936694145202637
227,2227912,Its first chairman was John Vassos and its first president was Henry Dreyfuss.,-23.845260620117188
228,889952,"Very tightly coupled computer clusters are designed for work that may approach ""supercomputing"".",-30.858583450317383
229,2343314,"They only last until 1937, when they closed the quarry and auctioned off the remaining equipment.",-37.83094024658203
230,3457705,"Alkire was born in Fay, Nevada in 1903 to Chester and Henrietta Alkire.",-40.03984451293945
231,276365,Its construction is similar to that of the Aeolian harp or Appalachian dulcimer.,-13.954363822937012
232,2270684,"Fjell was the 43rd most populous municipality in Norway with a population of 25,204.",-23.015474319458008
233,3217307,Jonni and Doll are shown to have started a relationship of sorts along with their working relationship.,-40.053714752197266
234,1945004,"Winter went 22–13 with 121 strikeouts in 1947, leading her team again to the playoffs.",-93.42666625976562
235,2961607,"During the lengthy period of ancient Rome, the Capitoline Hill was the geographical and ceremonial center.",-28.58924674987793
236,938404,"Two teenagers were found dead, evidently killed by shapeshifter agents from the parallel universe.",-25.001218795776367
237,1494850,"Original Soundtrack is the debut album by English dance music act S'Express, released in 1989.",-41.58940124511719
238,2488325,"As a result of her tendency to pitch severely, a ballast was permanently installed in the bow.",-34.61246871948242
239,2808712,"Sudoeste de Goiás Microregion is a region in southwest Goiás state, Brazil.",-10.386979103088379
240,433057,"Naturally, as everyone already knows, superheroes who have superpowers prevail here.",-14.041662216186523
241,1219709,Their occupation of the area is thought to have been intermittent due to the scarcity of water.,-14.071127891540527
242,3396281,"She said: ""I think they just sort of felt like, 'Why not?'""",-18.87874412536621
243,1235461,Khotons and Chantuu are Mongolized people with Turkic origin and speak in Mongolian.,-57.65607452392578
244,772762,"The property passed to his son, followed by Lord North, his eldest daughter's son.",-27.077754974365234
245,338902,"However, he never knew that the one book would be able to turn into so many volumes.",-33.29012680053711
247,453063,"In June 2005 the 17th Aviation Brigade in Korea was inactivated, along with its pathfinder detachment.",-32.920860290527344
248,1426881,Lahariya has been referred as one of the most influential Indians under 35 years of age.,-30.02109146118164
249,2818587,The town became part of the emirate of Cordoba in 756 and further fortifications were constructed.,-18.335865020751953
250,2058285,It is notable for its experimental and complex employment of multiple perspectives in a non-linear fashion.,-34.520294189453125
251,3049154,Above the belfry is a smaller square lantern stage with louvered openings and corner pilasters.,-21.96413230895996
252,2027335,"In mid-2008, it began running on The WB's online network in the US.",-27.267866134643555
253,3485215,She had been one of his students at Alexandra College in Dublin where he had once taught Classics.,-25.591381072998047
254,696824,"The channel is a part of the StarLightMedia broadcasting group, created by Viktor Pinchuk.",-44.35796356201172
255,2494034,"From there he undertook several expeditions in the Gran Chaco, which led him into southeast Bolivia.",-23.95052719116211
256,755721,The tribute concert included the same setlist as Dylan's 1963 concert at The Town Hall.,-21.575077056884766
257,350923,"The name ""New Spain"" had been suggested by Cortés and was later confirmed officially by Mendoza.",-19.779644012451172
258,2504699,"On 26 October, Lawes received his first call-up to the England Rugby Elite Squad.",-38.64871597290039
259,1611606,"Males had a median income of $29,861 versus $17,250 for females.",-14.18204116821289
261,1057077,The direct arm attaches to the posterior and lateral aspect of the fibular styloid.,-33.75674057006836
262,1085537,Binaca is an oral hygiene brand that is marketed in India and owned by Dabur.,-31.841651916503906
263,3081138,"The fencing at the church was created in 1903-1907, following Parland's designs.",-67.30747985839844
264,692875,Lila Rae Alcazar is the daughter of Lorenzo Alcazar and Skye Quartermaine.,-35.02637481689453
265,1630977,"Males had a median income of $28,125 versus $21,771 for females.",-13.924298286437988
266,3144110,"Ventspils University College is a higher education establishment in Ventspils, Latvia.",-7.704229354858398
267,1942186,"The general also sailed for Havana on January 8, barely one week after the siege was lifted.",-37.614532470703125
268,2602702,The Courier's leadership disallowed Schuyler's title of associate editor.,-22.266408920288086
269,485382,"Also, the company announced that it will have a multimedia campaign in South Korea involving the series.",-31.917932510375977
270,2763271,"Coleman was very gracious in defeat, and appeared on the ""Jimmy Kimmel Live!""",-22.482547760009766
271,2964772,"In the United States, the use of contractionary monetary policy has increased women’s unemployment.",-58.3560905456543
272,1041420,"The products of MUV have consistently identified God using the Buddhist term ""Burhan"".",-59.671356201171875
273,2786413,"Prices of the Jinbei X30 ranges from 35,000 yuan to 46,800 yuan.",-43.27271270751953
274,915547,The concrete element to the left bears a plaque with the names of the fallen and a dedication.,-43.472747802734375
275,2450666,"He also published intimate portraits of John Dewey, John Masefield, and George Santayana.",-22.5308895111084
276,2052702,"Fryerning is a small village situated approximately north of Ingatestone in Essex, England.",-27.327537536621094
277,3296149,"On 1 May 1909, passenger services commenced and the station was renamed Kami-Arita.",-19.72308921813965
278,954355,"They learn the whereabouts of him, by strategic publicizing of a generated photograph of the man.",-59.440940856933594
279,2793689,"514A explains the situation, and Selina tells him he is more normal than Bruce.",-37.83248519897461
280,12901,"Sporcle opened a sports bar in Ann Arbor, Michigan, called Haymaker Public House.",-46.002586364746094
281,1605116,Inglewood is moving its City Council elections to March 2020 to coincide with the California Primary election.,-23.56061363220215
282,2933492,"It was at this point, however, that the resort industry began to flourish in Forestburgh.",-35.876129150390625
283,1128982,"After the end of the Second World War, the study of Crusader castles experienced a lull.",-24.966249465942383
284,2712696,This placement earned them an invitation to the Intel Extreme Masters Season IX – World Championship in March.,-64.69329833984375
285,76315,"The program is presented by Don Francisco, who previously worked at ""Don Francisco Presenta"".",-24.776296615600586
286,829654,"For the opening game of the 2009 season, Rodgers recorded his first win in a comeback situation.",-41.58526611328125
287,3077450,"Later that year, he participated in the 2011 FIFA U-17 World Cup held in Mexico.",-9.3881254196167
288,2076031,"Lincoln also received mail that called him ""a negro"" and a ""mulatto"".",-17.588958740234375
289,725123,"In these bottom and deep layers of the gyre, it is completed by a southward movement.",-54.537757873535156
290,326935,"For examples, the United States completed its transition on 12 June 2009 and auctioned the spectrum.",-40.466041564941406
291,2188071,"Wong resigned as an MP on 17 January 2011, resulting in the 2011 Botany by-election.",-29.95884132385254
292,1463706,"SCR also produced his adaptation of Alexander Buravsky’s ""The Russian Teacher"".",-90.30381774902344
293,1572439,He received the Zee Cine Award Best Actor in a Supporting Role- Male for his performance.,-7.818359851837158
294,2923992,"For the 1961 Vuelta a España, the field consisted of 100 riders; 50 finished the race.",-20.233816146850586
295,3124012,The fight breaks Terry's probation and he is imprisoned while Mickey taunts him relentlessly.,-34.06381607055664
296,70712,"Secure Energy Services Inc. is a Canadian public energy services company, based in Calgary, Alberta.",-18.45357322692871
297,1390247,"William Codrington (died 1728), a descendant of Nathaniel Still, lived at Hutton Court.",-46.58009338378906
298,53023,"She has earned international acclaim for her experimental, documentary, animation, and cross-genre productions.",-27.740917205810547
299,1940570,Also had several PT-17 Stearmans and a few P-40 Warhawks assigned.,-22.236553192138672
300,660627,The New Mexico Storm are a former team in the American Indoor Soccer League (AISL).,-20.647409439086914
301,2180965,Many Swedish groups of the 1990s began to play a combination of D-beat with crust punk.,-49.43074035644531
302,1853196,"He was named as the ""outstanding young cricketer of the year"" by ""The Cricketer"".",-11.453433990478516
303,2222928,Memory consequences of looking back to notice change: Retroactive and proactive facilitation.,-55.87989044189453
304,122513,"He is of Samoan descent and was raised in Penrith, New South Wales, Australia.",-4.355205535888672
305,2080141,He was commissioned from the Reserve Officers' Training Corps and entered active duty as an Armor officer.,-12.762136459350586
306,1369364,"The following four national teams, shown with pre-tournament FIFA Rankings, participated in the tournament.",-21.542755126953125
307,2859799,Cincinnati developed with fewer immigrants and less influence from Europe than East Coast cities in the same period.,-21.951618194580078
308,2611808,"It features Come Winter, which was previously released on their internet-only debut Daphne Loves Derby.",-64.63861083984375
309,2208344,Macrocheilus vitalisi is a species of ground beetle in the subfamily Anthiinae.,-9.498100280761719
310,1433320,They received the titles of Merited Artists of Georgian SSR for their contribution to the cultural heritage.,-16.59465980529785
311,1487053,"When he rises from the ground, the lantern has been extinguished and the old woman has disappeared.",-17.655447006225586
312,2724480,"Previously, he served with Bank Negara, the Malaysian central bank, from 1968 to 2000.",-30.841365814208984
313,3370258,An annual subscription for the monthly journal was $1.00; one copy was 10 cents.,-29.590269088745117
314,1626412,Byron Township is a civil township of Kent County in the U.S. state of Michigan.,-12.899320602416992
315,1691143,"Lower canines are large in adults, and post-canine teeth exist in the lower jaw.",-34.93536376953125
316,2929318,"Han Yuqun (born 1943 in Suining, Jiangsu province) is a Chinese politician.",-25.875165939331055
317,767273,"Gordon Leonard Gosse Jr. (1955 – November 14, 2019) was a Canadian politician.",-70.75665283203125
318,988776,"Team Big Band is sent packing, but not without determination to come back and win the honeymoon.",-70.817138671875
319,2631668,This reduces the amount of total martensite by changing some of it to ferrite.,-16.056333541870117
320,619023,Troops for 115 SA Battalion were recruited from the self-governing territory of KwaNdebele.,-60.189823150634766
321,3131441,"The episode was written by Stephen Thompson and Steven Moffat, and directed by Douglas Mackinnon.",-21.01818084716797
322,240511,"Different researchers and proponents use different definitions, which complicates research and can affect diagnosis.",-32.291751861572266
323,3497747,"By 1679, La Louisiane française or French Louisiana was an administrative district of New France.",-34.25534439086914
324,1253538,"As cafeterias in France became more popular, their use spread beyond schools and into the workforce.",-24.31685447692871
325,3467938,"""Food Force 2"" is available for download on Linux, Windows and Mac OS X platforms.",-22.15614128112793
326,2909027,Housing in Red Location were categorised: Red location had no sewage system or electricity.,-20.47414779663086
327,2032527,"As wines were kept in barrels, they were not extensively aged, and thus drunk quite young.",-49.50000762939453
328,3369716,They have also stopped development of Firefox OS for the device at version 2.0.,-22.84160614013672
329,3214185,"In 2008 she was nominated for the ""International Olympiad on Astronomy and Astrophysics"" in Indonesia.",-27.65961265563965
330,895740,Khoo Thean Teik had the monopoly for indentured migrant workers from China.,-49.4852294921875
331,2533910,"In 1913, Fritz Heymann Nathan, a Danish Jew, founded Nathan & Olsen in Reykjavík.",-45.64088439941406
332,3343552,The newspaper temporarily relocated to an office at 35 Fitzroy Street opposite the City Centre Plaza shopping centre.,-34.13939666748047
333,2064717,Phillips became available after being fired as head coach of the Dallas Cowboys halfway through the 2010 season.,-25.922029495239258
334,282827,He served in the Illinois militia during the Winnebago War and the Black Hawk War.,-1.299041986465454
335,3099274,"The Roman Catholic bishop's seat is located at Christ the King Cathedral, Mullingar.",-3.3917105197906494
336,1168183,Masani barrage is named after the Masani village in Rewari District of Haryana in India.,-12.755367279052734
337,166444,"Previously, illegal immigrants with children would be released with a notice to appear before an immigration judge.",-28.278396606445312
338,2089491,The 2008–09 season finished with the Couchiching Terriers taking the overall best record.,-63.41987991333008
339,1664843,Both songs were also released in Canada on the REO label (REO 8217).,-22.225351333618164
340,531740,The paper tape is pulled by motorized rollers at a constant speed under the siphon pen.,-38.223899841308594
341,2022121,"""Ezhu"" means stand up and ""mave"" means mango tree in Malayalam.",-29.353607177734375
342,3390043,"Javier's opened a location at the Westfield UTC in San Diego, California in January 2019.",-51.232032775878906
343,1602412,The society becomes susceptible to similar wrongdoings in the absence of proper handling of preceding occasions.,-44.878944396972656
344,2775698,A brick fireplace in the front room is covered with green tile and has an oak mantel.,-22.00270652770996
345,2976194,"This trend is also beginning to take effect in Vancouver, and to a lesser extent, Montréal.",-23.385520935058594
346,1048326,"It reached number 1 on iTunes Japan and number 33 on ""Billboard""s Japan Hot 100.",-22.376380920410156
347,1348552,He made his list A umpiring debut in 2006 and his first class debut in 2007.,-6.143784046173096
348,43136,"Former Thorn, Steph Catley was able to strike first for Orlando in the 12th minute.",-67.56393432617188
350,371196,"Dan and Jane continue to fight it out with the remaining gang members, although both are wounded.",-27.793750762939453
351,1445846,"The majority of the instructors were priests from the Archdiocese, who taught in their areas of specialization.",-22.517608642578125
352,3230772,"He was traded back to Washington on August 9, but signed with Pittsburgh before the 2012 season.",-20.60515785217285
353,2937941,The gender makeup of the village was 48.3% male and 51.7% female.,-1.7460131645202637
354,295173,The power plant consists of 510 heliostats and has a capacity of 5 MWth.,-31.68143081665039
355,776349,"The video is available on select singles and the DVD-Audio version of ""Up!"".,-30.977806091308594
356,3079093,"To the west and southwest, water flows out to the sea by way of San Antonio Creek.",-17.735252380371094
357,2476402,"Two other historical works are attributed to Eudemus, but here his authorship is not certain.",-26.427743911743164
358,1989008,Expansion increased dramatically over the next three decades to almost all land-grant universities in the country.,-22.09597396850586
359,541638,The raw data can sometimes be uploaded to another service provider to produce an additional interpretation and matches.,-53.92692565917969
360,2407205,Laotian Civil War broke out between communist Pathet Lao and pro-American Kingdom of Laos.,-15.676862716674805
362,2111598,The new lineup played two dates at the Fillmore before appearing at Woodstock in mid-August.,-13.76091480255127
363,3350656,"For example, a group of birds would refuse to cross even the smallest stretches of open water.",-26.357833862304688
364,2264176,This continued down to 1840 when the barony of Dublin City was separated from the barony of Dublin.,-25.614648818969727
366,3141859,They did not show at the scheduled first match against Adana İdmanyurduspor.,-36.114994049072266
367,2889197,This would be the worst position the club would end up during their time in the Coast League.,-32.950233459472656
368,1592460,"On October 21, 2016 he suffered a stroke to which he succumbed on November 18, 2018.",-33.118743896484375
369,2986050,"Though most heavy fighting ended on October 28, the fighting never stopped until January 18, 1974.",-48.17646408081055
370,623099,"With the grant money, the band decided to finish recording an album that was released in 2016.",-34.14356994628906
371,3403813,"The teams in the bottom group, positioned in positions 9-14 would continue the relegation fight.",-38.04485321044922
372,905938,"With that ""Little angel with blond hair"", Liszt's daughter Blandine was meant.",-51.663795471191406
373,128183,"On June 30, he agreed to a three-year, $11.1 million extension.",-16.192855834960938
374,2143191,"In it, William Shatner sits down with various celebrities and conducts offbeat interviews with them.",-9.180952072143555
375,2827394,"The Dark Guardians found Nova and ambushed him, wounding him enough to crash land onto a planet.",-52.79634475708008
376,1268387,Farmers can wait until sufficient late spring / summer moisture is present and then make use of it.,-25.72555923461914
377,2052460,"In 2008, Parise served as an alternate captain for the American team at the World Championships.",-14.342554092407227
378,2538498,Flair operates a fleet of Boeing 737-400 aircraft capable of transporting up to 156 passengers worldwide.,-34.674964904785156
380,1747418,General freight traffic was withdrawn on 14 June 1965 although coal was still handled until 4 December 1967.,-39.91783142089844
381,446584,Papal Legate Anthony was not permitted to enter Moscow carrying in front of him the Latin cross.,-33.11334228515625
382,2779015,Both of Diana's older sisters had also received matching chokers on their 18th birthdays.,-26.21758270263672
383,150832,"Milne was the eldest son of Alexander Milne of Crimonmogate, an Aberdeen merchant.",-38.265380859375
384,2439088,"The AllMusic reviewer commented that the album presented ""bop-based jazz singing at its best.""",-31.902122497558594
385,742048,"Some princes left the festival without permission, as others used the opportunity for conspiracies.",-42.300689697265625
386,805405,He signed for Liverpool on 11 May 1955 as an amateur and became a full professional in 1957.,-26.872467041015625
387,1216491,"Josephine ""Josie"" Rohrs was born and raised in the community of Napoleon, Ohio.",-32.4091796875
388,13831,"Hornussen is another indigenous Swiss sport, which is like a cross between baseball and golf.",-52.101844787597656
389,1034961,Restoring Eden is a rapidly growing network of Christians working to become a grassroots movement within the church.,-34.261253356933594
391,3000346,"""The Rake's Progress"" was produced at the Sadler's Wells Theatre in 1935.",-22.122095108032227
392,2769957,"Dwight died at OhioHealth Berger Hospital on May 6, 2020 at the age of 87.",-56.62272262573242
393,854149,"Among them, José Mujica who became the 40th President of Uruguay from 2010 to 2015.",-32.987586975097656
394,546908,"As Andrus was only 20 years old, Texas signed veteran shortstop Omar Vizquel for insurance.",-41.94061279296875
395,3489266,"Confirming this speculation, Websense Security Labs identified additional sites using the exploit on January 19.",-62.73805236816406
396,3220229,The sculptures appear made of bright red ribbon-like strips of painted aluminum that snake skyward.,-45.994266510009766
397,3439325,"On Megatron's orders, Soundwave assembles a strike team to find said key.",-33.874427795410156
398,1425878,"On March 4, free agent center Matt Birk left the Vikings to join the Baltimore Ravens.",-23.696247100830078
399,1958794,"Both decoders use the sub-block of ""m"" likelihoods for the payload data.",-51.885257720947266
400,2331803,But the question of how it is that these systems are subjects of experience is perplexing.,-31.31033706665039
401,1238372,"This group settled farther west than the first group, choosing less expensive land in the Lancaster area.",-34.51940155029297
402,3070882,"In the ""Blue Exorcist"" musical, he was portrayed by Yūki Tamaki.",-34.51844787597656
403,319152,"Cruse also has a specialist website for young people, hopeagain.org.uk.",-36.743186950683594
404,1982740,"Without it, ""the face of biomedicine and biotechnology would look totally different.""",-27.370853424072266
405,2586470,Belle calls on the help of her former bike messengers to pinpoint the location of the car.,-32.5672607421875
406,1312275,The Sartano river flows through the CD Block and Sudana river on the eastern part.,-61.034217834472656
407,897814,Bowers played in Major League Baseball as an outfielder for the Baltimore Orioles in the 1996 season.,-11.799091339111328
408,3190265,"He resumed the practice of law and also became interested in various business enterprises in Salem, Ohio.",-21.540096282958984
409,1072178,Bailey Finch was Hunter's (Lee Donoghue) drug dealer and fellow junkie.,-44.10021209716797
410,1166202,"They then launched the Great Dickens Christmas Fair in San Francisco, an indoor event, in 1970.",-74.87278747558594
411,2694415,"With UN approval, Truman decided on a ""rollback"" policy—conquest of North Korea.",-46.37915802001953
412,1932366,The terms frump and old fart have also been used as words to designate similar qualities.,-37.00062942504883
413,1280379,Suitably designed trollers can also catch mackerels effectively when they swim near the surface.,-38.711517333984375
414,2409998,Soon after his workmen had left Leo reoccupied the site and rebuilt the fortress.,-33.268497467041016
415,3160066,"Nyantakyi defeated two other candidates, Ade Coker and Kojo Bonsu.",-55.53230667114258
416,3076622,"Paultons Square is a Georgian terraced garden square in Chelsea, London, SW3.",-36.738807678222656
417,3348137,He also works as a lawyer in Dumbarton and is also a popular after dinner speaker.,-15.921454429626465
418,1003992,Route 1 enters Pekalongan Regency some 450 m later after crossing Sepait River.,-43.01554870605469
419,1565581,It was quickly determined that focus on customer experience was key in reversing the slippage.,-39.35257339477539
420,2518921,The Border reivers were raiders along the Anglo-Scottish border between the 13th and 16th centuries.,-15.032669067382812
421,2281024,Table legs shall be at least 40 cm from the end line of the table for wheelchair players.,-46.98957824707031
422,1902886,"There were also 8 prisons, 23 juvenile facilities, and 211 pre-trial facilities in 2019.",-49.965484619140625
423,1253906,"Briggs struggled to land any meaningful punches, as Klitschko won every round decisively.",-36.816627502441406
424,3054450,Railroad tracks that were once the property of the Denver and Rio Grande Western Railroad end in town.,-20.000240325927734
425,2486394,"That year, first several ribs were uncovered and later part of the vertebral column.",-35.146175384521484
426,3509979,"""S-18"" sank the coaster and ""S-24"" sank the French ship .",-26.559303283691406
427,658039,This historic street is located one to three blocks to the northwest of the Pineapple Apartments site.,-44.10547637939453
428,471073,Gas Attack is a 2001 drama created and produced by Samantha Kingsley and directed by Kenny Glenaan.,-83.08558654785156
429,363898,"It is located within the British Sovereign Base Areas, and is the southernmost point of the island.",-23.62158203125
430,15553,In each case one plate is fixed and the other slides on top as expansion or contraction occurs.,-34.935638427734375
431,2450975,"""So far he's taking care of the baby, but he'll be around.""",-26.59710693359375
