sample_id,sent_id,sentence,prob_1
0,1605783,The population density was 183.4 people per square mile (70.9/km²).,-7.319732189178467
1,2661329,He was also one of the rare contributors interpreting the existing contemporary caste system at a theoretical level.,-56.917640686035156
2,2898647,"(Since the graph is a triangulation, the charge on each face is 0.)",-23.138874053955078
3,673581,"The theme song is ""After You've Gone"" and is performed by Jamie Cullum.",-8.409947395324707
4,604843,"His folklore film database has recordings from Ukraine, China, Transylvania, Iran, India and others.",-76.6906967163086
5,1696223,"The year 1525 in science and technology included many events, some of which are listed here.",-24.419715881347656
6,2130297,"The stone was placed against the house, leaving the grave site unmarked and unidentified on the property.",-29.525848388671875
7,3532189,"From 1913 to 1922, he was publisher of the journal ""Le Nourrisson"".",-31.159955978393555
8,1150380,"""Tapolca"" is also the name of the town where the district seat is found.",-21.802921295166016
9,2019017,The Baptist Church was built in 1807 on what was then the corner of Edwards and Pine Streets.,-28.03114891052246
10,2280837,Henry David Thoreau was a major proponent of self-rule in lieu of immoral governments.,-19.635236740112305
11,3039925,"The gmina covers an area of , and as of 2019 its total population is 12,560.",-39.566200256347656
12,2968175,"This roundel clearly does not belong to the vase, and has been displayed separately since 1845.",-49.538475036621094
13,714354,"It stars Superstar Upendra, Challenging Star Darshan, Radhika and Sanghavi.",-32.21837615966797
14,1577576,"Kysilewsky, however, was unable to join him due to a negative health report.",-40.70355987548828
15,533557,"The ridge, which is situated towards the north of the parish, is approximately above sea level.",-27.436498641967773
16,537214,"In an age before the internet and sites such as Amazon.com, this idea was innovative.",-18.189748764038086
17,2536866,The second series was nominated for the Best Drama prize at the 2008 Rose d'Or ceremony.,-20.656837463378906
18,1608382,"Other sections are served by Silver Lakes Middle in North Lauderdale, Lauderdale Lakes Middle in Lauderdale Lakes.",-36.33462142944336
19,2267692,Except Admiral Shariff who continued to press pressure on Indian Navy until the end of the conflict.,-41.93683624267578
20,1174984,"""This is the end for us,"" Gippius allegedly commented, disgusted and horrified.",-38.25216293334961
21,1920220,Aarong is an enterprise of one of the largest social development organizations in Bangladesh - BRAC.,-60.65238571166992
22,1275155,"However, the majority of the Goths escaped and began retreating south the way they had come.",-23.781719207763672
23,1588365,"4 was recorded live at the Drum Logos club in Fukuoka, Japan on June 14, 2000.",-62.24703598022461
24,964487,From this time until his death he was the most prominent man in this part of the State.,-13.475301742553711
25,3407526,The Afghanistan Journalists' Centre announced that local volunteer radio presenter Ahmadkhan Nawid was killed.,-62.26078796386719
26,3071220,He was wanted by the state police of several states in India for his involvement in criminal activities.,-17.44371795654297
27,544225,The Deep Rock Oil Corporation was an undercapitalized subsidiary of the defendant Standard Gas Company.,-48.80958557128906
28,1397053,"In July 2014, the makers released a motion poster of the film, revealing the first look.",-33.6568489074707
29,748510,His politically oriented parents chose to make a statement by deciding to remain living in the changing neighborhood.,-53.073638916015625
30,412137,She represents the electoral district of Saskatoon Churchill-Wildwood as a member of the Saskatchewan Party.,-23.11375617980957
31,3199826,"He moved to Humboldt County, California, and established the land office at Humboldt Point in 1858.",-36.70454788208008
32,2505581,"While she spends many years in prison, Rigor is slowly dragged into a life of violence.",-29.985517501831055
33,2624613,Bonner is a 2012 inductee into the Arena Football League's Hall of Fame.,-12.441997528076172
34,1208431,He won three Under 21 national titles English National Table Tennis Championships in 2001 and 2003 and 2004.,-50.39887237548828
35,3058726,"Only rarely would the proportion be 100:0, as in ""The Oropesa"".",-36.00587463378906
36,2674329,"He was buried at Santa María Magdalena de Pazzis Cemetery in San Juan, Puerto Rico.",-13.011528015136719
37,2660904,Section 14 covers more general issues including that the law does not govern schools that only teach religion.,-35.543678283691406
39,2784410,Between 1734 and 1753 Schnell also appeared as a publisher of sacred music by other composers.,-26.68500328063965
40,1197749,"His work in this field led to him to write his first book, ""Samsung Rising"".",-27.42152976989746
41,298939,The front facade features a massive one-story pedimented portico at the central entrance bay.,-16.41248893737793
42,1394242,"Through this repeated process, the chimaera finally begin to win against the seraphim.",-29.698997497558594
43,1632529,The population density was 64.7 people per square mile (25.0/km²).,-6.491033554077148
44,1237648,"An argument with Thelonious Monk during the recording of ""Bags' Groove"" was reported.",-25.65483283996582
45,475154,The school currently had enrollment of 136 students in grades 6-12 at the time of closing.,-13.805967330932617
46,3320002,The Le Puiset branch consists of the descendants of Everard I of Breteuil.,-18.22545051574707
47,881857,"Since 2001, he has been a senior research fellow at the Constitution Unit of University College London.",-20.47052001953125
48,2764091,In December 2005 Drayson published a report entitled The Defence Industrial Strategy (DIS).,-29.99540901184082
49,3460586,He is a vocal advocate of significant United States economic support and diplomatic influence in the Caribbean region.,-36.667633056640625
50,3017032,He first explains Tyson's sarcastic order to shoot the civilians the morning of the Hue massacre.,-66.0826416015625
51,160630,Leopold I appointed Field Marshall Raimondo Montecuccoli to lead an army to Transylvania.,-30.353153228759766
52,1472842,The status of Palm Springs Stadium was unclear in the late 1990s and early 2000s (decade).,-20.34436798095703
53,1283635,Orwell fell seriously ill in March 1929 and shortly afterwards had money stolen from the lodging house.,-32.30157470703125
55,2433583,Gian Paolo Palenteri was ordained a priest in the Order of Friars Minor Conventual.,-24.293886184692383
56,726955,There is a parking lot inside the entrance for visitors who wish to bike or hike the road.,-30.64301872253418
57,1639028,"Millard is a village in Pettis Township, Adair County, Missouri, United States.",-16.98920440673828
58,1263093,Kalla was also seen as a potential vice-presidential candidate for the incumbent Megawati.,-20.308582305908203
59,1597225,"To date, there have been several types of Copper Nitrite Reductases discovered.",-16.24148178100586
60,2103733,"At about elevation they established a camp called ""Sunday Station"" at the edge of the forest.",-48.658103942871094
61,3396770,"Angolan nationalists began fighting for independence in 1961, achieved in 1975 following a revolution in Portugal.",-35.77946472167969
62,2038915,"After her commissioning, she was assigned to the 4th Destroyer Flotilla with the Mediterranean Fleet until 1936.",-35.475738525390625
63,1228548,"Nevertheless, he often impressed travelers at his grandfather's inn with his phenomenal mathematical faculty.",-39.389427185058594
64,2008608,"It also borders the countries of Paraguay, to the southwest, and Bolivia, to the west.",-13.855095863342285
65,1499324,He died less than a month after leaving office and five weeks after being awarded a knighthood.,-9.21182632446289
66,1960611,"On September 24, 1770, a bevy of angry Regulators took over the Hillsboro Court.",-36.31920623779297
67,1946875,"Langford also had one serious science fiction novel published in 1982, ""The Space Eater"".",-32.079505920410156
68,1825018,"Using sequential story-telling, Goldstein creates a bright, plastic, pop-surrealist narrative.",-48.09351348876953
69,2555616,"ME Bank, also known as ME, is an Australian direct bank based in Melbourne, Victoria.",-19.43423843383789
70,2964301,"In addition, he became the spokesperson for the company as part of the three-year contract.",-19.32889175415039
71,2742536,"""People would call my father at 3 a.m. with questions,"" Ahmad said.",-40.31095886230469
72,3138133,He was also a director of the First National Bank of Chicago and Lackawanna Steel Company.,-14.144678115844727
73,2839514,Seenu (Nithin) is a new admit at Maharaja College of Arts and Sciences.,-43.90061569213867
74,804775,"2017 - Mystic Timbers, a Great Coasters International wooden roller coaster added and Winterfest returns.",-72.03192901611328
75,1133185,"Previous names for the ground include Lyallpur Stadium, National Stadium, and City Stadium.",-18.50291633605957
76,27408,"Women suffered all kinds of atrocities because men held the belief that women were the weaker sex.""",-31.3386173248291
77,532196,"When he gets in the car, he notices that the mileage is set to the Numbers.",-25.17048454284668
79,1890090,She has also tried her hand at modeling and has a contract with the Li Ning company.,-15.813406944274902
80,1605737,The population density was 254.4 people per square mile (98.2/km²).,-6.895798683166504
81,473330,The school was founded in 1981 and is affiliated to the Central Board of Secondary Education of India.,-8.639875411987305
82,1614088,"Males had a median income of $25,909 versus $18,125 for females.",-14.240939140319824
83,2732872,Its main focus was to reduce greenhouse emissions to about 45-65% of the 2003 levels.,-39.35270690917969
84,1262179,"After the failed qualification for the 1986 World Cup, Olle Nordin took over the team.",-22.745689392089844
85,1659307,Hamilton led from the start with Räikkönen closely following and Alonso a few seconds behind them.,-17.48790740966797
86,844491,He represented Sri Lanka at the 2018 Summer Youth Olympics in October 2018 which was held in Argentina.,-16.946325302124023
87,2973426,The government then relocated to Villa Somalia in the capital from its interim location in Baidoa.,-57.621559143066406
88,3162455,"Meanwhile, Nine-Tailed Fox is being hunted down by an old enemy and must evade capture.",-17.844249725341797
89,2830808,"He began so successfully that he received the nickname of ""Little prophet"" which he always retained.",-41.22206497192383
90,2030160,"Johannes Aldert ""Jan"" Bergstra (born 1951) is a Dutch computer scientist.",-25.4837646484375
91,1328771,These pickups were used in American Deluxe Series Guitars and Basses from 2004 until early 2010.,-33.57762145996094
92,1204610,It is known that Pdr1p induces the expression of Rpn4p.,-28.59231185913086
93,2547287,"Indiana's population continued to grow after the war, exceeding five million by the 1970 census.",-18.0024471282959
94,1710924,Temperatures in summer frequently exceed and make cropping without irrigation risky without sophisticated meteorological forecasting techniques.,-46.21436309814453
95,3422215,"Weil, influenced by her mother's beliefs, joined the Daughters of Zion in 1912.",-33.605384826660156
96,836165,The park also contains the regional headquarters for Matanuska-Susitna Valley area parks.,-27.312538146972656
97,2079370,"By 2000, however, the station was struggling to make the top ten in 12+ ratings.",-34.05704116821289
98,1401377,"Hot rolled parts are usually dark and dull, their surface oxidized from being hot worked.",-55.43285369873047
99,3496191,He was also Federal Commissioner (South South) in National Assembly Service Commission from 2003 to 2005.,-62.28724670410156
100,298172,"Budoff died in her home on December 6, 2008, in Delray Beach, Florida.",-35.33037185668945
101,2452677,The largest class of electric locomotives are the Sr1 locomotives that were taken into use in 1973.,-50.235252380371094
102,2703015,"The church and well are of great antiquity, being mentioned in a royal charter of 939.",-35.202945709228516
103,1088613,She immediately sailed towards them and after a two-hour running fight was able to capture one.,-34.23362350463867
104,2956968,The population density was 14.0 people per square mile (5.4/km²).,-4.745061874389648
105,3433291,A secretory gland nourishes the contained spermatozoa in the vagina.,-16.88846778869629
106,1652706,"Between 1977 and 2002, their division rivals were Denver, San Diego, Kansas City and Oakland.",-26.184749603271484
108,2335551,"The word ""blin"" is also often used as a soft curse word, expressing frustration.",-32.69927215576172
109,2949521,"Males had a median income of $22,152 versus $18,583 for females.",-16.803939819335938
110,1005534,Jack does not believe that the relationship is serious since Carol never stays at Liz's apartment.,-40.458152770996094
111,78894,"Finally, there would be a new chairman position to be split off of the existing CEO position.",-31.962890625
112,1837914,"At the hospital, Wallace and Chantry run into Wallace's ex-girlfriend, Megan.",-24.766889572143555
113,1157045,"It was played from March 7 to 10, in Kansas City, Missouri at the Sprint Center.",-14.453957557678223
114,1247093,"In 1998, St. Jerome's changed its name to St. Jerome's University.",-6.513306140899658
115,3483934,"He was a committed Christian, adhering to the Catholic Apostolic Church and later the Anglican Church.",-18.143661499023438
116,1632263,"Males had a median income of $31,149 versus $20,573 for females.",-16.71195411682129
117,704967,She competed in both the 1983 and 1987 World Championships in Athletics - Women's high jump.,-9.347434043884277
118,3112313,"Also, Jan Berry himself and his parents appear in the audience at the end of the movie.",-45.78434371948242
119,3480160,William Harris was one of seven children born to William and Madelaine Harris in Western Australia.,-12.081893920898438
120,1981659,"However, the last three years have had a rebound that stabilized the period between 1992 and 2005.",-45.661659240722656
121,1704900,This country is in an undeclared and unexplained war in Vietnam.,-22.017675399780273
122,3385695,"The rector purchased a lot on Elm Street that year, and began construction of a temporary chapel.",-25.773347854614258
123,1341998,"He has the ability to gather natural materials into his body, affecting his strength and maneuverability.",-27.641334533691406
124,3300575,"Since its inaugural meeting in, the IAFSS has grown to more than four hundred members.",-40.974693298339844
125,2989353,"In Ghent (capital of East Flanders), the incumbent mayor Daniël Termont is very popular.",-30.61640167236328
126,2924032,"His funeral was attended at his suburban residence ""Smitholm"" on August 4, 1905.",-58.68622589111328
127,2247035,The cavalrymen fended off a PVA attack from the northeast that lasted into the afternoon.,-22.4981689453125
128,1975555,"In 1984, Shikaoi began a sister town relationship with Stony Plain, Alberta, Canada.",-44.123741149902344
129,1038893,"Messrs. T. Murdoch, James and Barker joined the squad from the match against Australia.",-41.982547760009766
130,104477,The concept of nullification of federal law by the states was not discussed at the Constitutional Convention.,-26.912160873413086
131,2356986,McIlwraith made 33 appearances for Motherwell from 1973 to 1975 and scored seven goals.,-12.400018692016602
132,424054,"He came from an Irish Catholic background, and was also a member of the Irish Nationalist League.",-17.709726333618164
133,164449,"Albers, in the sole remaining Spyker, retired on lap nine with a gearbox fire.",-34.1718864440918
134,3021221,"""The Secret of Moonacre"" was met with a mixed to negative reception from critics.",-16.327726364135742
135,3199596,"Directed by Anton Corbijn, the video itself features alternating depictions of vocalist Henry Rollins.",-26.423019409179688
136,2089664,"In 1961, she was the second inductee of the North Dakota Roughrider Award.",-26.699371337890625
137,67415,"Heyden was the son of the ""Baumeister"" Johann Christian Heyden the elder.",-6.42659330368042
138,1155811,"She replaced Sakhi Gokhale in the famous play, Amar Photo Studio in 2018.",-65.08406066894531
139,987852,Percy Goodman scored 34* but otherwise the wickets fell rapidly and the score eventually reached only 328.,-51.550262451171875
140,1369480,James Vlasto was managing editor and spokesman for the family when the newspaper closed in 1973.,-41.74284362792969
141,2050610,"As of June 2012, PUSD's at-large board districts became geographic subdistricts.",-38.06195831298828
142,1472874,"1,253 people are employed in the secondary sector and there are 72 businesses in this sector.",-12.10147476196289
143,2593255,"McRae was born in Carron, Falkirk, where his father was an electrician.",-13.024598121643066
144,3087866,"They are raised as brother and sister, and Ja'far pays for Hamid's education.",-10.783734321594238
145,2343971,The film score and the soundtrack were composed by film composer G. Sathya Prasath.,-24.11800193786621
146,3526769,For a number of years film exhibitors voted Johnson among the most popular stars in the country:,-38.782806396484375
147,201182,"The original building was constructed in 1901 and expanded in 1929, 1953, 1964, and 1974.",-28.629959106445312
148,3205232,There was also a sandpit where dredger deposited sand used for constructions around the city.,-34.73750305175781
149,2807887,Seven academicians of the RA NAS perform scientific and pedagogical work at the University.,-40.861854553222656
150,2625736,Abad Santos was appointed Secretary (later Minister) of Justice by President Ferdinand Marcos in 1970.,-26.03893280029297
151,143527,The association was created by Louise Otto-Peters and Auguste Schmidt in Leipzig on 18 October 1865.,-68.66666412353516
152,109593,Evans was one of the torch bearers during the torch relay prior to the 2012 Summer Olympics.,-17.547584533691406
153,570590,"He added that he had been covering for Profumo, whose Commons statement was substantially false.",-35.33605194091797
154,1948033,"Reflecting its much larger size, in 1978 the parish council declared itself thenceforth a town council.",-22.537734985351562
155,1042520,"During World War II, he commanded the USS Sheboygan (PF-57).",-7.212535858154297
156,1570151,None of the bombers returned to base—only three 18 Squadron and one 614 crew survived.,-78.18826293945312
157,1067059,She received her Masters of Community Medicine from in 1987 also from the University of Khartoum.,-39.74152755737305
158,3523688,He is blindfolded while a captor reads a speech for two minutes and ten seconds.,-34.656837463378906
159,2718807,"Merger negotiations failed in 2014, as did an takeover bid by CA Immo in spring 2015.",-67.74900817871094
161,3077045,Aaron ben Isaac Sason was an Ottoman author and Talmudist; born in Constantinople in 1629.,-50.98924255371094
162,3317308,"Jan Oxenberg (1950) is an American film producer, director, editor, and screenwriter.",-21.049232482910156
163,417512,"If person wants to transport a bike in a Prague train, ticket for oversized luggage is needed.",-68.75541687011719
164,1195803,"Jake Hancock wrote in 1989: ""Dennis Curry's work is marked by its extraordinary breadth.",-53.83497619628906
165,3128875,"Thanks to direct contact with contemporaries, he conveys the unique spirit and energy of his heroes.",-41.642822265625
166,2370978,The film also revealed that he was charged for drug trafficking in 1993 by the United States Government.,-24.012807846069336
167,1536239,"The Takeda main body held firm, despite fierce rotating attacks by the Uesugi.",-32.165348052978516
168,38942,The share price growth added more than $5 billion to Match Group's market capitalization.,-33.06293869018555
169,266065,"""Jennings County"" departed San Diego on 11 September, arriving at Chu Lai on 11 November.",-35.82243347167969
170,3240316,"By the time Jefferson County began their mandatory evacuation, local roads were already full of Houstonians.",-29.53250503540039
171,1932185,"He was one of 362 ""foreign specialists"" at the plant when he started working there.",-26.99299430847168
172,3343369,Pretiosa agrees only if Don John consents to live as a gypsy for two years.,-41.04014587402344
173,1101179,Edwards returned for the third test which was won 23–4 by Australia at Elland Road.,-57.69920349121094
174,595107,"She had always dreamed of writing plays, and she began writing and acting in her teenage years.",-7.5777974128723145
175,1027078,"Born in Germany to Jewish parents, he studied graphic design at the Reimann School in Berlin.",-14.440128326416016
176,535968,The attack on Clery was one of 38 violent crimes recorded at the university in three years.,-39.16128158569336
177,1252739,"It shakes the branches with its feet, hands, or a combination while hanging from its tail.",-37.46646499633789
178,3308900,She is a member of the Polish feminist punk group which combines lyrical ballads with contemporary protest songs.,-42.84531021118164
179,896225,Part of the game's development was outsourced to American middleware provider Phantom Reality.,-36.29890823364258
180,463999,"His strong, raucous sound on the trombone and wild outbreaks on stage were characteristic.",-59.01487731933594
181,1824998,"The song ""Fighting for You"" is a duet, featuring guest vocals from Carroll Sue Hill.",-39.95454406738281
182,3160821,A search for the lost airframe by the National Underwater and Marine Agency Australia has been proposed.,-32.54979705810547
183,2024187,The road winds north through forests and forms the eastern border of Nolde Forest Environmental Education Center.,-40.21044158935547
184,1699449,"According to INRIX, Windermere is the first real estate company to offer this feature.",-26.613542556762695
185,347554,The two are primarily used by sellers to determine the auction type that maximizes the expected price.,-43.25224304199219
186,1548581,The 1850–1990 MHz PCS band is divided into six frequency blocks (A through F).,-78.94790649414062
187,1635608,The community was named for Boston financer and railroad promoter H. H. Hunnewell.,-40.627357482910156
188,2843064,The administrative offices of the theatre and the box office on Rampart Street suffered extensive water damage.,-25.74899673461914
189,2488895,Her self-taught ability to read music was an added bonus as this saved valuable studio time.,-36.23583984375
190,3115998,"According to the 2004 census (INE), the municipality has a population of 82 inhabitants.",-6.19983434677124
191,679627,In late 2007 the company announced its intention to make RPR training and material more widely available.,-41.86988830566406
192,1210627,Liverpool's opening Premier League fixture was at Anfield against West Ham United on 12 August.,-16.34832000732422
193,1399976,The evacuated fort of Itakhuli was then occupied by the Chetia Borphukan.,-59.94731903076172
194,2633861,"After the ""World"" folded, he became a foreign correspondent for the ""Toronto Star"".",-12.989216804504395
195,2437896,"The Kirk Franklin show attracting such amount of audience that exceeded the 14,000-capacity dome.",-59.41223907470703
196,438461,Ritva Salonen (28 February 1936 – 28 March 1996) was a Finnish gymnast.,-56.72050857543945
197,958980,Jimmy's attempts to promote goodwill and community spirit amongst his relatives and neighbours are frequently frustrated.,-41.53037643432617
198,1017832,"They are hardy to USDA zones 11, above 4.5 °C (40 °F).",-22.931028366088867
199,2542375,"SDH is found widely in nature, but its structural and chemical properties vary greatly among species.",-21.263473510742188
200,516993,"In addition, the exhibit contains 50 pairs of civilian shoes representing the Iraqi civilians killed during occupation.",-35.35171890258789
201,356507,Unredeemed pledges may be sold at any time after the loan expires.,-16.729982376098633
202,2847533,"Helensburgh railway station is on the South Coast railway line, linking Sydney to Wollongong.",-9.311528205871582
203,2255176,"John de Vere, 13th, Earl of Oxford, was Henry's principal military commander.",-27.620559692382812
204,115286,He was a Member (MP) of the Parliament of England for Ripon in 1559.,-6.185616493225098
205,1423557,The regional studio for Vienna is located on the Argentinierstaße 30a in Vienna.,-58.27777862548828
206,2750699,"For the next six years, the Battalion aided the Nicaraguan government until peace was finally restored.",-21.575130462646484
207,317721,"His son Mitch Acker is President of Martinaire Partner, LLC, of Dallas, Texas.",-40.12308883666992
208,2547744,the match between Dickie Laws and Stanley Newman was played at Thurston's Hall.,-29.354820251464844
209,954206,"Tibet is nicknamed ""the roof of the world"" or ""the land of snows"".",-29.774158477783203
210,1178478,Argentina throughout its history has always depended on foreign trade to achieve a solid economic and social growth.,-28.412185668945312
211,1787061,Lindh had to choose between standing up for human rights and supporting trade relations with the US.,-30.108684539794922
212,3107309,"On 11 June 2019, Jajalo signed a three-year deal with Udinese.",-39.556697845458984
213,1393160,"""Do Right Woman, Do Right Man"" was written by Chips Moman and Dan Penn.",-26.76190757751465
214,1552255,"He then served as assistant editorial page editor and in 2004, he became its deputy foreign editor.",-29.76456069946289
215,1414820,The Venezuela men's national softball team is the men's national softball team of Venezuela.,-0.02994251623749733
